{
  "catalogVersion": "0.1.0",
  "locale": {
    "direction": "ltr",
    "englishName": "Hindi",
    "fallback": "en",
    "gettextCategories": [
      "one",
      "other"
    ],
    "gettextPluralRule": "nplurals=2; plural=(n != 1);",
    "pluralCategories": [
      "one",
      "other"
    ],
    "tag": "hi"
  },
  "messages": {
    "accessibility.source_content": {
      "sourceRevision": 1,
      "status": "draft",
      "template": "अनुवाद किया जाने वाला टेक्स्ट"
    },
    "accessibility.stop_translation": {
      "sourceRevision": 1,
      "status": "draft",
      "template": "अनुवाद रोकें"
    },
    "accessibility.translation_output": {
      "sourceRevision": 1,
      "status": "draft",
      "template": "स्ट्रीम किया गया अनुवाद आउटपुट"
    },
    "action.cancel": {
      "sourceRevision": 1,
      "status": "draft",
      "template": "रद्द करें"
    },
    "action.clear_history": {
      "sourceRevision": 10,
      "status": "draft",
      "template": "Clear history"
    },
    "action.clear_memory": {
      "sourceRevision": 13,
      "status": "draft",
      "template": "Clear translation memory"
    },
    "action.close": {
      "sourceRevision": 11,
      "status": "draft",
      "template": "Close"
    },
    "action.close_settings": {
      "sourceRevision": 1,
      "status": "draft",
      "template": "सेटिंग बंद करें"
    },
    "action.connect": {
      "sourceRevision": 1,
      "status": "draft",
      "template": "Connect"
    },
    "action.create_routing_profile": {
      "sourceRevision": 28,
      "status": "draft",
      "template": "Create local-first profile"
    },
    "action.delete_history_entry": {
      "sourceRevision": 11,
      "status": "draft",
      "template": "Delete"
    },
    "action.delete_memory_entry": {
      "sourceRevision": 13,
      "status": "draft",
      "template": "Delete"
    },
    "action.delete_routing_profile": {
      "sourceRevision": 28,
      "status": "draft",
      "template": "Delete"
    },
    "action.document_jobs": {
      "sourceRevision": 16,
      "status": "draft",
      "template": "Document jobs"
    },
    "action.edit_routing_profile": {
      "sourceRevision": 31,
      "status": "draft",
      "template": "Edit"
    },
    "action.enable_fallback": {
      "sourceRevision": 18,
      "status": "draft",
      "template": "Allow approved fallback"
    },
    "action.export_glossary": {
      "sourceRevision": 8,
      "status": "draft",
      "template": "Export glossary"
    },
    "action.export_history": {
      "sourceRevision": 11,
      "status": "draft",
      "template": "Export history"
    },
    "action.export_memory": {
      "sourceRevision": 13,
      "status": "draft",
      "template": "Export translation memory"
    },
    "action.export_output": {
      "sourceRevision": 5,
      "status": "draft",
      "template": "Export translation"
    },
    "action.export_routing_profile": {
      "sourceRevision": 34,
      "status": "draft",
      "template": "Export"
    },
    "action.import_glossary": {
      "sourceRevision": 8,
      "status": "draft",
      "template": "Import glossary"
    },
    "action.import_routing_profile": {
      "sourceRevision": 34,
      "status": "draft",
      "template": "Import profile"
    },
    "action.move_candidate_down": {
      "sourceRevision": 30,
      "status": "draft",
      "template": "Move candidate down"
    },
    "action.move_candidate_up": {
      "sourceRevision": 30,
      "status": "draft",
      "template": "Move candidate up"
    },
    "action.open_output": {
      "sourceRevision": 17,
      "status": "draft",
      "template": "Open exported output"
    },
    "action.open_source": {
      "sourceRevision": 1,
      "status": "draft",
      "template": "टेक्स्ट फ़ाइल खोलें"
    },
    "action.pause_document": {
      "sourceRevision": 16,
      "status": "draft",
      "template": "Pause document"
    },
    "action.remove_profile": {
      "sourceRevision": 1,
      "status": "draft",
      "template": "Remove saved profile"
    },
    "action.resume_document": {
      "sourceRevision": 16,
      "status": "draft",
      "template": "Resume document"
    },
    "action.retry_document": {
      "sourceRevision": 16,
      "status": "draft",
      "template": "Retry document"
    },
    "action.retry_translation": {
      "sourceRevision": 19,
      "status": "draft",
      "template": "Retry translation"
    },
    "action.routing_profiles": {
      "sourceRevision": 28,
      "status": "draft",
      "template": "Routing profiles"
    },
    "action.save_provider": {
      "sourceRevision": 1,
      "status": "draft",
      "template": "प्रदाता सहेजें"
    },
    "action.save_routing_profile": {
      "sourceRevision": 31,
      "status": "draft",
      "template": "Save routing profile"
    },
    "action.select_document_job": {
      "sourceRevision": 16,
      "status": "draft",
      "template": "Select document job"
    },
    "action.translate": {
      "sourceRevision": 1,
      "status": "draft",
      "template": "अनुवाद करें"
    },
    "action.use_routing_profile": {
      "sourceRevision": 29,
      "status": "draft",
      "template": "Use"
    },
    "action.view_history": {
      "sourceRevision": 11,
      "status": "draft",
      "template": "View history"
    },
    "action.view_memory": {
      "sourceRevision": 13,
      "status": "draft",
      "template": "View translation memory"
    },
    "app.title": {
      "sourceRevision": 1,
      "status": "draft",
      "template": "LinguaMesh"
    },
    "diagnostics.locale": {
      "sourceRevision": 22,
      "status": "draft",
      "template": "Locale"
    },
    "diagnostics.model_selected": {
      "sourceRevision": 22,
      "status": "draft",
      "template": "Model selected"
    },
    "diagnostics.model_selection_pending": {
      "sourceRevision": 22,
      "status": "draft",
      "template": "Model selection pending"
    },
    "diagnostics.no": {
      "sourceRevision": 22,
      "status": "draft",
      "template": "No"
    },
    "diagnostics.onboarding": {
      "sourceRevision": 22,
      "status": "draft",
      "template": "Onboarding"
    },
    "diagnostics.output_bytes": {
      "sourceRevision": 22,
      "status": "draft",
      "template": "Output bytes"
    },
    "diagnostics.persisted_active_profile": {
      "sourceRevision": 22,
      "status": "draft",
      "template": "Persisted active profile"
    },
    "diagnostics.profile_deletion_pending": {
      "sourceRevision": 22,
      "status": "draft",
      "template": "Profile deletion pending"
    },
    "diagnostics.profile_storage": {
      "sourceRevision": 22,
      "status": "draft",
      "template": "Profile storage"
    },
    "diagnostics.profile_storage_available": {
      "sourceRevision": 22,
      "status": "draft",
      "template": "Available"
    },
    "diagnostics.profile_storage_pending": {
      "sourceRevision": 22,
      "status": "draft",
      "template": "Pending"
    },
    "diagnostics.profile_storage_unavailable": {
      "sourceRevision": 22,
      "status": "draft",
      "template": "Unavailable"
    },
    "diagnostics.provider": {
      "sourceRevision": 22,
      "status": "draft",
      "template": "Provider"
    },
    "diagnostics.provider_saved": {
      "sourceRevision": 22,
      "status": "draft",
      "template": "Provider saved"
    },
    "diagnostics.routing_decision": {
      "sourceRevision": 29,
      "status": "draft",
      "template": "Routing decision"
    },
    "diagnostics.saved_model": {
      "sourceRevision": 22,
      "status": "draft",
      "template": "Saved model"
    },
    "diagnostics.saved_profile": {
      "sourceRevision": 22,
      "status": "draft",
      "template": "Saved profile"
    },
    "diagnostics.saved_profiles": {
      "sourceRevision": 22,
      "status": "draft",
      "template": "Saved profiles"
    },
    "diagnostics.status": {
      "sourceRevision": 22,
      "status": "draft",
      "template": "Status"
    },
    "diagnostics.summary": {
      "sourceRevision": 1,
      "status": "draft",
      "template": "Core ABI {core_abi} · प्रोटोकॉल {protocol}"
    },
    "diagnostics.theme": {
      "sourceRevision": 22,
      "status": "draft",
      "template": "Theme"
    },
    "diagnostics.title": {
      "sourceRevision": 1,
      "status": "draft",
      "template": "निदान"
    },
    "diagnostics.yes": {
      "sourceRevision": 22,
      "status": "draft",
      "template": "Yes"
    },
    "dialog.document_jobs": {
      "sourceRevision": 16,
      "status": "draft",
      "template": "Document jobs"
    },
    "dialog.export_glossary": {
      "sourceRevision": 8,
      "status": "draft",
      "template": "Export glossary"
    },
    "dialog.export_history": {
      "sourceRevision": 11,
      "status": "draft",
      "template": "Export translation history"
    },
    "dialog.export_memory": {
      "sourceRevision": 13,
      "status": "draft",
      "template": "Export translation memory"
    },
    "dialog.export_routing_profile": {
      "sourceRevision": 34,
      "status": "draft",
      "template": "Export routing profile"
    },
    "dialog.export_translation": {
      "sourceRevision": 5,
      "status": "draft",
      "template": "Export translation"
    },
    "dialog.history": {
      "sourceRevision": 11,
      "status": "draft",
      "template": "Translation history"
    },
    "dialog.memory": {
      "sourceRevision": 13,
      "status": "draft",
      "template": "Translation memory"
    },
    "dialog.open": {
      "sourceRevision": 1,
      "status": "draft",
      "template": "खोलें"
    },
    "dialog.open_glossary": {
      "sourceRevision": 8,
      "status": "draft",
      "template": "Import glossary"
    },
    "dialog.open_routing_profile": {
      "sourceRevision": 34,
      "status": "draft",
      "template": "Import routing profile"
    },
    "dialog.open_text_file": {